66,The Oriental Pavilion,270.0,16.50264644,80.64798639,Vijayawada,https://www.tripadvisor.in/Restaurant_Review-g303876-d3667537-Reviews-The_Oriental_Pavilion-Vijayawada_Krishna_District_Andhra_Pradesh.html,"We had tomato rice & Onion pakodas for lunch. . enough quantity in a single plate. . tasted good. . slightly expensive as its located in a 4 Star HotelMoreWe had tomato rice & Onion pakodas for lunch. . enough quantity in a single plate. . tasted good. . slightly expensive as its located in a 4 Star HotelMoreWe had get to gether party at Chinese restaurant with family..food and was awesome and tasty service was too good people are well professional and they maintaining all covid standards and hygiene food thanks you teamMoreWe had get to gether party at Chinese restaurant with family..food and was awesome and tasty service was too good people are well professional and they maintaining all covid standards and hygiene food thanks you teamMoreExcellent service good food and tasty....staff was too god all are following hygienic standards... Weekends to busy at restaurant... And also chinese items was nice and good presentation..we enjoyed a lotMoreExcellent service good food and tasty....staff was too god all are following hygienic standards... Weekends to busy at restaurant... And also chinese items was nice and good presentation..we enjoyed a lotMoreMy family visit fortune muralipark, oriental pavilion restaurant food was very good,Pacific lemon gross chilli Chicken nice taste.good corporate the oriental team.MoreMy family visit fortune muralipark, oriental pavilion restaurant food was very good,Pacific lemon gross chilli Chicken nice taste.good corporate the oriental team.MoreYummy delicious food and friendly staff Very polite and decent healthy food to eat Thanks to Mr Sandeep for the guidanceMoreYummy delicious food and friendly staff Very polite and decent healthy food to eat Thanks to Mr Sandeep for the guidanceMorefood is very nice specially the place is very cool and with a nice ambiance and i can say it's a beautiful place to visit with family alsoMorefood is very nice specially the place is very cool and with a nice ambiance and i can say it's a beautiful place to visit with family alsoMoreI feel very happy with service very good and neat atmosphere was very cool me and my friends enjoy lotMoreI feel very happy with service very good and neat atmosphere was very cool me and my friends enjoy lotMoreMe and my family enjoyed so lot the food was really good atmosphere feel very comfortable. My kids enjoyed so lotMoreMe and my family enjoyed so lot the food was really good atmosphere feel very comfortable. My kids enjoyed so lotMoreGood food nice taste different kind of items.nice atmosphere me and my friends really enjoyed.thanksMoreGood food nice taste different kind of items.nice atmosphere me and my friends really enjoyed.thanksMoreReally I enjoyed the food different kind of iteams nice place good atmosphere.i feel very happy.nice staff good experience with Mr.kiran.MoreReally I enjoyed the food different kind of iteams nice place good atmosphere.i feel very happy.nice staff good experience with Mr.kiran.MoreGood service and food particular crispy fried fish with roasted chili sauce nice taste.staff was very good courtesy And support.MoreGood service and food particular crispy fried fish with roasted chili sauce nice taste.staff was very good courtesy And support.MoreFood and ambiance is damn good the hotel staff are we helping and friendly and always ready to assist you at anytimeMoreFood and ambiance is damn good the hotel staff are we helping and friendly and always ready to assist you at anytimeMoreMe and my friends enjoyed . Good food nice atmosphere.different kind of varaities.really super taste.MoreMe and my friends enjoyed . Good food nice atmosphere.different kind of varaities.really super taste.MoreReally me and family enjoyed so lot.good atmosphere nice staff.food was really good .excellent different kinds of varieties.really we enjoyedMoreReally me and family enjoyed so lot.good atmosphere nice staff.food was really good .excellent different kinds of varieties.really we enjoyedMoreRecently I visited j feel very comfortable nice place .good atmosphere. Nice staff. Really food was awesome I loved it.MoreRecently I visited j feel very comfortable nice place .good atmosphere. Nice staff. Really food was awesome I loved it.More",0.82,Restaurant,0
67, Crossroads Restaurant,268.0,16.51935783,80.65994638,Vijayawada,https://www.tripadvisor.in/Restaurant_Review-g303876-d5900248-Reviews-Crossroads_Restaurant-Vijayawada_Krishna_District_Andhra_Pradesh.html,"very low quantity, very high prices. worst experience, never go again, order for family pack dum biryani, it is enough for only one person, not 2 persons.very low quantity, very high prices. worst experience, never go again, order for family pack dum biryani, it is enough for only one person, not 2 persons.Worste service i have ever scene in India,.No respect on customers.mainly the first floor manager named sai. Worste behaviour and irresponsible irrespective person.i hate cross roads resturant vijayawada.vij and ibrahimpatn road.hate the behaviour of management.dont go with family or couple.Worste service i have ever scene in India,.No respect on customers.mainly the first floor manager named sai. Worste behaviour and irresponsible irrespective person.i hate cross roads resturant vijayawada.vij and ibrahimpatn road.hate the behaviour of management.dont go with family or couple.@gannavaram, Food is good but preparing by bore water. When I asked for hot water they supplied bore water without informing. Which caused me serious throat infection from past 5days. I called to the manager, but no response. Inta kakruthi enduku? I might have paid...More@gannavaram, Food is good but preparing by bore water. When I asked for hot water they supplied bore water without informing. Which caused me serious throat infection from past 5days. I called to the manager, but no response. Inta kakruthi enduku? I might have paid...MoreI have been visiting this restaurant since year 2011.My cousin took me there 1st time in year 2011 and since then its my favourite restaurant in vijayawada They have 3 branches Moghalrajpuram Branch, Besant Road and Gollapudi Branch. I have never been to Besant road...MoreI have been visiting this restaurant since year 2011.My cousin took me there 1st time in year 2011 and since then its my favourite restaurant in vijayawada They have 3 branches Moghalrajpuram Branch, Besant Road and Gollapudi Branch. I have never been to Besant road...MoreAverage food and decent service. Nothing much to add. Good for a quick bite and ideal for families. Portion sizes were goodAverage food and decent service. Nothing much to add. Good for a quick bite and ideal for families. Portion sizes were goodI really enjoyed food very tasty and fantastic Aroma I really enjoyed should I want to visit with my family next time thanks management teamI really enjoyed food very tasty and fantastic Aroma I really enjoyed should I want to visit with my family next time thanks management teamWorst food Worst fried rice..ever in my life Low quality spoiled cashew in cashew curry Worst manchuriaWorst food Worst fried rice..ever in my life Low quality spoiled cashew in cashew curry Worst manchuriaI visited this place solo.I visited this place with my colleagues for the meeting it is the best for official lunch and dinner.I visited this place solo.I visited this place with my colleagues for the meeting it is the best for official lunch and dinner.After long time eaten tasty biriyani thanks to crossroad team, I want to visit this restaurant again with my family clean and green hotel thanks to allAfter long time eaten tasty biriyani thanks to crossroad team, I want to visit this restaurant again with my family clean and green hotel thanks to allvisited with family best non veg food found little bit expensive here i liked the biryani and starters also very good herevisited with family best non veg food found little bit expensive here i liked the biryani and starters also very good hereGood place to dine in. The dum biriyanis are yummy. must try the family pack which can serve to 4 people at once and comes with chilly chicken which is delicious too.Good place to dine in. The dum biriyanis are yummy. must try the family pack which can serve to 4 people at once and comes with chilly chicken which is delicious too.Good ambience well maintained with calm and decent ambience hygenic food is served staff is friendly to customersGood ambience well maintained with calm and decent ambience hygenic food is served staff is friendly to customersWhen i had a heart about to eat Prawns Biryani i will go here and i eat my stomach fully they had a family sitting and bachelors and place so clean nd tidy its best palce to eat only in vijayawada 2 branches i think...MoreWhen i had a heart about to eat Prawns Biryani i will go here and i eat my stomach fully they had a family sitting and bachelors and place so clean nd tidy its best palce to eat only in vijayawada 2 branches i think...MoreToday visited Crossroads restaurant in Vijayawada for lunch with my coligue. Restaurant atmosphere is good. Staff are polite. Food is also OK. But the price is very high. Wash rooms cleanness should improve. Location is easily accessibleToday visited Crossroads restaurant in Vijayawada for lunch with my coligue. Restaurant atmosphere is good. Staff are polite. Food is also OK. But the price is very high. Wash rooms cleanness should improve. Location is easily accessibleThe atmosphere and the table setup was good. And the food als good but the staff they are behind of tips. If u did good service to the guest they will tip u. Overall ok.The atmosphere and the table setup was good. And the food als good but the staff they are behind of tips. If u did good service to the guest they will tip u. Overall ok.",0.46,Restaurant,0
68,Sri Ramayya Mess,244.0,16.51196983,80.63292035,Vijayawada,https://www.tripadvisor.in/Restaurant_Review-g303876-d10324296-Reviews-Sri_Ramayya_Mess-Vijayawada_Krishna_District_Andhra_Pradesh.html,"Not sure why this place got so many ratings. Firstly its highly unhygienic place. Dining room is old fashion, unclean. Didn't serve entire food together. When lunch was about to be over, he served curd... Main thing that gave me terrible feeling... There is toilet...MoreNot sure why this place got so many ratings. Firstly its highly unhygienic place. Dining room is old fashion, unclean. Didn't serve entire food together. When lunch was about to be over, he served curd... Main thing that gave me terrible feeling... There is toilet...MoreFood okay varieties are good. Special Meals seem to be good. Space constraints. The staff are courteous. With family lunch is difficult due to space constraintsFood okay varieties are good. Special Meals seem to be good. Space constraints. The staff are courteous. With family lunch is difficult due to space constraintsThis mess is about 20 -25 minutes walk from vijayawada railway station. Not sure which is the nearest bus stop to this mess. There are three categories of meals available in this mess Rs 130,Rs 180 and Rs 230. The variation of amount is because...MoreThis mess is about 20 -25 minutes walk from vijayawada railway station. Not sure which is the nearest bus stop to this mess. There are three categories of meals available in this mess Rs 130,Rs 180 and Rs 230. The variation of amount is because...MoreA very busy restaurant located in a very busy centre. But the food can be summed up in just one word--- Awesome. They serve Andhra Thali with three price range, which differs in the number of items on the thali and the AC We opted...MoreA very busy restaurant located in a very busy centre. But the food can be summed up in just one word--- Awesome. They serve Andhra Thali with three price range, which differs in the number of items on the thali and the AC We opted...MoreExcellent taste. Very good service. Not a great Ambience. Air conditioners provide additional chillness at localised areas in the restaurant. So you need to choose the comfortable space as per your convenience. They have categorised the lunch served into three sections of Rs.110, Rs.160 and...MoreExcellent taste. Very good service. Not a great Ambience. Air conditioners provide additional chillness at localised areas in the restaurant. So you need to choose the comfortable space as per your convenience. They have categorised the lunch served into three sections of Rs.110, Rs.160 and...MoreVery good food. We had veg meals. Food very tasty. Staff was very helpful and lovingly served food. Though language was a challenge, staff managed and patiently understood our requirements and helped. Average ambience which was more than made up for by taste and service.Very good food. We had veg meals. Food very tasty. Staff was very helpful and lovingly served food. Though language was a challenge, staff managed and patiently understood our requirements and helped. Average ambience which was more than made up for by taste and service.this a amazing lil restaurant which serves amazing Andhra food platter and has different room for different price range thali and food items , We didn't knew language and being a Punjabi had no idea of food but the owner took special effort to make...Morethis a amazing lil restaurant which serves amazing Andhra food platter and has different room for different price range thali and food items , We didn't knew language and being a Punjabi had no idea of food but the owner took special effort to make...MoreQuality of Food above average, price is ok. This restaurant has locational advantage. It is ok to visit now and thenQuality of Food above average, price is ok. This restaurant has locational advantage. It is ok to visit now and thenSuch a least rate they give tasty food. Their service is super and give so many varieties. They are giving sealed 500ml water bottle and ice cream to every customer.Such a least rate they give tasty food. Their service is super and give so many varieties. They are giving sealed 500ml water bottle and ice cream to every customer.The enterence is deceptive ..inside three mini halls ..,one for meals at Rs110,next for Rs200 and another at Rs160. The menu for all three is in the board at the enterence. All are unlimited meals. We had the Rs160 one...quite few items staring with Badam...MoreThe enterence is deceptive ..inside three mini halls ..,one for meals at Rs110,next for Rs200 and another at Rs160. The menu for all three is in the board at the enterence. All are unlimited meals. We had the Rs160 one...quite few items staring with Badam...Moregood meals at budget price nice homely food as waiting is much too much crowded at this old small hotel .... tasty meals ....good meals at budget price nice homely food as waiting is much too much crowded at this old small hotel .... tasty meals ....After a long time, I could find a very delicious Authetic ANDHRA Thali, well organised, air conditioned mess, They serve every thing for taste, then serve unlimited what you want. So many varieties. Very hygienic and organised Restaurant . Appreciate staff and owners , I...MoreAfter a long time, I could find a very delicious Authetic ANDHRA Thali, well organised, air conditioned mess, They serve every thing for taste, then serve unlimited what you want. So many varieties. Very hygienic and organised Restaurant . Appreciate staff and owners , I...MoreVery nice Andhra meals. Traditional Andhra dishes.neatly arranged veg. meals with lot of varieties. We recommended it for food lovers.Very nice Andhra meals. Traditional Andhra dishes.neatly arranged veg. meals with lot of varieties. We recommended it for food lovers.Me and my friends visit this hotel nice faculty good tasty food tea is very good tasty , I want to visit this hotel with my family againMe and my friends visit this hotel nice faculty good tasty food tea is very good tasty , I want to visit this hotel with my family againThe Vegetarian Restaurant is typically for those who want to taste authentic Andhra fare. Their Thali served in Various forms is worth trying.We Chose Special Andhra Thali. It was very good though spicy.But you should expect this in Vijayawada.Good Restaurant,The Vegetarian Restaurant is typically for those who want to taste authentic Andhra fare. Their Thali served in Various forms is worth trying.We Chose Special Andhra Thali. It was very good though spicy.But you should expect this in Vijayawada.Good Restaurant,",0.4,Restaurant,0
69,McDonald's,229.5,16.50589799,80.66366118,Vijayawada,https://www.tripadvisor.in/Restaurant_Review-g303876-d11822282-Reviews-McDonald_s-Vijayawada_Krishna_District_Andhra_Pradesh.html,I taken large meal with less price I changed fries to chicken wings it's very nice taste and yummy food in McDonald'sI taken large meal with less price I changed fries to chicken wings it's very nice taste and yummy food in McDonald'sI visited Vijayawada McDonalds with my friends.i enjoyed a lot with them.the price just high but quantity is goodI visited Vijayawada McDonalds with my friends.i enjoyed a lot with them.the price just high but quantity is goodI have visited to McDonald's with my family it was so nice to see and eat food nice display menu soit has goodI have visited to McDonald's with my family it was so nice to see and eat food nice display menu soit has goodUr food was so nice and good covid orecations by manger it was sk nice to see mcd in VIJAYAWADA it has good food to see it.Ur food was so nice and good covid orecations by manger it was sk nice to see mcd in VIJAYAWADA it has good food to see it.We visited to this wow great fries taste and all are wearing masks and gloves good to see the party hall to spend timebthereWe visited to this wow great fries taste and all are wearing masks and gloves good to see the party hall to spend timebthereVisiting 3 rd time wow food great service friendly managers gave party hall to us enjoying with friends will come always hereVisiting 3 rd time wow food great service friendly managers gave party hall to us enjoying with friends will come always hereSafety precautions restaurant is following glouse and mask all employees are wearing hygiene was good nice and visitSafety precautions restaurant is following glouse and mask all employees are wearing hygiene was good nice and visitBeen here manytimes like the taste of the food and the place and precautions you take for the covid-19Been here manytimes like the taste of the food and the place and precautions you take for the covid-19Cool food with fun conservation and with a fast service and friendly environment with best covid stepsCool food with fun conservation and with a fast service and friendly environment with best covid stepsIt was nice good it has well corna mantines in store level and social distancing was well manting it was good.It was nice good it has well corna mantines in store level and social distancing was well manting it was good.Fine it was good mangers r in customer area and it was good to visit parking was ok it has most capacity to bring highFine it was good mangers r in customer area and it was good to visit parking was ok it has most capacity to bring highSuperb food I really enjoyed it nice area for family and friends gost chilli spicy chicken was awesomeSuperb food I really enjoyed it nice area for family and friends gost chilli spicy chicken was awesomeSuperb food I really enjoyed the food and they are following well sanitizing process all staff were friendly &they are giving more offers I really enjoyed gost chilli spicy fried chickenSuperb food I really enjoyed the food and they are following well sanitizing process all staff were friendly &they are giving more offers I really enjoyed gost chilli spicy fried chickenMcDonald's doing a speed service and godd offers also they are following well SANATINGIN procedures alsoMcDonald's doing a speed service and godd offers also they are following well SANATINGIN procedures alsoI have visited to 7 pm in that time there is si much resh but the employes of mcd very humble to each and every guestI have visited to 7 pm in that time there is si much resh but the employes of mcd very humble to each and every guest,0.78,Restaurant,0
