35, WelcomCafe Oceanic,2575.0,17.77248022,83.37376411,Vishakapatnam,https://www.tripadvisor.in/Restaurant_Review-g297588-d7072401-Reviews-WelcomCafe_Oceanic-Visakhapatnam_Visakhapatnam_District_Andhra_Pradesh.html,"Very good service,food as well as ambience…really liked the way they received us…good for spending time with family -dafneVery good service,food as well as ambience…really liked the way they received us…good for spending time with family -dafneFood was fantastic and also the ambiance…Eswar and Durga did a good service and we had d a satisfactory afternoonFood was fantastic and also the ambiance…Eswar and Durga did a good service and we had d a satisfactory afternoonSupriya, soubhik and sindhu were excellent at taking care of the guests. They were present and explained the dishes before serving.Supriya, soubhik and sindhu were excellent at taking care of the guests. They were present and explained the dishes before serving.Great service, good food - host supriyo was amazing. Would definitely recommend a visit here. Thanks for the experience.Great service, good food - host supriyo was amazing. Would definitely recommend a visit here. Thanks for the experience.Nice calm ambience. Not in your face music. Knowledgeble and cordial staff. Good service by Supriyo there.Nice calm ambience. Not in your face music. Knowledgeble and cordial staff. Good service by Supriyo there.Excellent taste and plating by Chef Manoj. He took us to the paradise with his Bolognese. If you are looking for Italy in india Manoj chef preparation will satisfy you.Excellent taste and plating by Chef Manoj. He took us to the paradise with his Bolognese. If you are looking for Italy in india Manoj chef preparation will satisfy you.Yet Another time, WelcomOceanic has ceased to surprise us with saucy sprit of Multicuisine delicacies Thanks to:Supriyo ,Jayanth , Laimwn It's a sure go-go for me for a appetizing eveningYet Another time, WelcomOceanic has ceased to surprise us with saucy sprit of Multicuisine delicacies Thanks to:Supriyo ,Jayanth , Laimwn It's a sure go-go for me for a appetizing eveningThe food and the ambience are very good. And the service of Mr Supriyo was very good. He gave very good options for us to have and we enjoyed the food and drinks.The food and the ambience are very good. And the service of Mr Supriyo was very good. He gave very good options for us to have and we enjoyed the food and drinks.I had a great experience with my friends. Staff was incredible helpful. Food was great with huge quantity. Thank you MR chand and MR Durga for your wonderful service.I had a great experience with my friends. Staff was incredible helpful. Food was great with huge quantity. Thank you MR chand and MR Durga for your wonderful service.Awsome place for family to visit, nice facility'sFamily Had a wonderful time here, to celebrate a family event. Great food and very warm service. Really wonderful experience!Thanks jayanth,prathana,joshwa and morami ....Awsome place for family to visit, nice facility'sFamily Had a wonderful time here, to celebrate a family event. Great food and very warm service. Really wonderful experience!Thanks jayanth,prathana,joshwa and morami ....The ambiance was very good and food was amazing.thank jayanth,morami and prathana,chef Sandeep who made good bhelpuri for us.we will definitely visit again.The ambiance was very good and food was amazing.thank jayanth,morami and prathana,chef Sandeep who made good bhelpuri for us.we will definitely visit again.You made my stay great. Thanks for all the you did. You are an asset to the hotel. Welcome hotel is the best place to stay.You made my stay great. Thanks for all the you did. You are an asset to the hotel. Welcome hotel is the best place to stay.I came for a family trip and my room was upgraded ( I got the sea view room 😊) by the lady on the reception by herself. The entire staff is so helpful and welcoming. Everyone in the restaurant ( especially Prarthana and Roopa) go...MoreI came for a family trip and my room was upgraded ( I got the sea view room 😊) by the lady on the reception by herself. The entire staff is so helpful and welcoming. Everyone in the restaurant ( especially Prarthana and Roopa) go...MoreI stayed at WelcomeITC hotel and was very very pleased with the hospitality of Ms Prarthana at the Welcome Cafe Oceanic. She has been highly efficient and amazing in her sense of customer service. I am an Ambassador level member with the Marriott group and...MoreI stayed at WelcomeITC hotel and was very very pleased with the hospitality of Ms Prarthana at the Welcome Cafe Oceanic. She has been highly efficient and amazing in her sense of customer service. I am an Ambassador level member with the Marriott group and...MoreLovely staff, work hard to meet all needs, breakfast servcie with view of the pool and large dining areaLovely staff, work hard to meet all needs, breakfast servcie with view of the pool and large dining area",0.66,Restaurant,0
36, Vista (The Park),2425.5,17.77231675,83.3742791,Vishakapatnam,https://www.tripadvisor.in/Restaurant_Review-g297588-d4783392-Reviews-Vista_The_Park-Visakhapatnam_Visakhapatnam_District_Andhra_Pradesh.html,"This time here .Awesome place ,awesome food.very good ambience . Superb seashore. Moreover we enjoyed all. recommend to friends and colleagues.This time here .Awesome place ,awesome food.very good ambience . Superb seashore. Moreover we enjoyed all. recommend to friends and colleagues.Nice place to vista the restaurant and it has wide range of buffet spread in it and good staff, good foodNice place to vista the restaurant and it has wide range of buffet spread in it and good staff, good foodGood food specially chicken butter masala with lacha paratha was my choice. it really nice . Ambiance and service was great. see you very soon.Good food specially chicken butter masala with lacha paratha was my choice. it really nice . Ambiance and service was great. see you very soon.Good food and ambience.. praiseworthy service by Mr Arnab who made sure that we were comfortable and had a good timeGood food and ambience.. praiseworthy service by Mr Arnab who made sure that we were comfortable and had a good timeExcellent view with great ambiance vista having. Food was very good and service was extraordinary. Staffs are very cooperative .Must recommend this place to family and friends.Excellent view with great ambiance vista having. Food was very good and service was extraordinary. Staffs are very cooperative .Must recommend this place to family and friends.We stayed at the park after 2 years visiting this hotel this time also I got service but I did not got last time Memorial service by L M Rahul Rao Chauhan he was caring with good smile good respect but I missing this timeI...MoreWe stayed at the park after 2 years visiting this hotel this time also I got service but I did not got last time Memorial service by L M Rahul Rao Chauhan he was caring with good smile good respect but I missing this timeI...MoreWhat is not properly cooked. I have reached the restaurant at 1:30 PM but they have not even ready. The food is worst at vista. Ambience of the hotel is very goodWhat is not properly cooked. I have reached the restaurant at 1:30 PM but they have not even ready. The food is worst at vista. Ambience of the hotel is very goodI have enjoyed a lot. The food is little bit salty but it’s tasteful. The scenery of location is very beautiful. Thank you for making my family happyI have enjoyed a lot. The food is little bit salty but it’s tasteful. The scenery of location is very beautiful. Thank you for making my family happyThank you !! We are happy. Foood is good !! Service is good , Especially Arnab hosted well Had a happy stay with my love of lifeThank you !! We are happy. Foood is good !! Service is good , Especially Arnab hosted well Had a happy stay with my love of lifeThank u Arnab..!Very kind person to serve..! Highly tolerable person..!! Perfectly served Everything..!!Thank u Arnab..!Very kind person to serve..! Highly tolerable person..!! Perfectly served Everything..!!The Hotel is situated on the highway and has good surroundings. The interior is very good and lavish. It is a good place to have various functions. It is a family friendly place and good for weekend getaway to relax and enjoy.vipin was very helpful...MoreThe Hotel is situated on the highway and has good surroundings. The interior is very good and lavish. It is a good place to have various functions. It is a family friendly place and good for weekend getaway to relax and enjoy.vipin was very helpful...MoreAwesome place. Huge space with a lot of amenities. Swimming pool was clean and well maintained. Service provider mr. Vipin was very helpful. Nice entrance. Food was also good and tasty. Definitely a family placeAwesome place. Huge space with a lot of amenities. Swimming pool was clean and well maintained. Service provider mr. Vipin was very helpful. Nice entrance. Food was also good and tasty. Definitely a family placeProperty is very good and food quality is excellent. Veg food is awesome, Veg Platter was the start in starters.... staff is very polite and helpful... Special mention to vista staff who served us nicely...Property is very good and food quality is excellent. Veg food is awesome, Veg Platter was the start in starters.... staff is very polite and helpful... Special mention to vista staff who served us nicely...Excellent place to plan enjoyment. I went here during one of my office parties. Clean well maintained place, well behaved staff especially restaurant, nice location away from city chaos, good food. The place is even more beautiful during rainy season. Swimming/outdoor activities can be planned....MoreExcellent place to plan enjoyment. I went here during one of my office parties. Clean well maintained place, well behaved staff especially restaurant, nice location away from city chaos, good food. The place is even more beautiful during rainy season. Swimming/outdoor activities can be planned....MoreVery beutifull resturant..good service by staff.everything is hear like best rooms,wedding hall,swiming pool,dining hall or much more especially thanks to vista staff for take caring us.Very beutifull resturant..good service by staff.everything is hear like best rooms,wedding hall,swiming pool,dining hall or much more especially thanks to vista staff for take caring us.",0.78,Restaurant,0
37,Dakshin,2035.0,17.72843115,83.34209377,Vishakapatnam,https://www.tripadvisor.in/Restaurant_Review-g297588-d5071898-Reviews-Dakshin-Visakhapatnam_Visakhapatnam_District_Andhra_Pradesh.html,"Delicious food ….must visit place in vizag . We tried the pulao and many starters along with mutton curry . Everything was very tastyDelicious food ….must visit place in vizag . We tried the pulao and many starters along with mutton curry . Everything was very tastyExcellent ambiance,Aunthetic food felt like home.Sindhu and Shovak served us very nice like family.Must visit placeExcellent ambiance,Aunthetic food felt like home.Sindhu and Shovak served us very nice like family.Must visit placeThe food and ambience is very good. The supporting staff Sindhu and shovik are very good in explaining the menu and serving the food.The food and ambience is very good. The supporting staff Sindhu and shovik are very good in explaining the menu and serving the food.Great ambience and food is very tasty especially non veg thali. Great service by staff Sindhu, Morami and manmadha.Great ambience and food is very tasty especially non veg thali. Great service by staff Sindhu, Morami and manmadha.Visited this place post recommendation by one of family friend. Amazed with services and food. A must visit for lunch or dinner. Would like to appreciate Sindhu, Mouarmi and Manmadha for their hospitality.Visited this place post recommendation by one of family friend. Amazed with services and food. A must visit for lunch or dinner. Would like to appreciate Sindhu, Mouarmi and Manmadha for their hospitality.Enjoyed a nice meal here, with great recommendations from Sindhu based on the things I like and my spice palate. Would recommend for visitorsEnjoyed a nice meal here, with great recommendations from Sindhu based on the things I like and my spice palate. Would recommend for visitorsIt was an amazing dining experience and the hospitality was top notch. It was our wedding anniversary and we loved the surprise from the team. Special mention to Sindhu, Manmada, Eshwar and Mourami for their amazing hospitality and ensuring we have an amazing dining experience....MoreIt was an amazing dining experience and the hospitality was top notch. It was our wedding anniversary and we loved the surprise from the team. Special mention to Sindhu, Manmada, Eshwar and Mourami for their amazing hospitality and ensuring we have an amazing dining experience....MoreMy wife and I decided to have an impromptu date night. It is quite ironic that a south Indian city would have a South Indian Fine Dining cuisine... but I must confess that they had some amazing food from the 4 south Indian states. Sindoo...MoreMy wife and I decided to have an impromptu date night. It is quite ironic that a south Indian city would have a South Indian Fine Dining cuisine... but I must confess that they had some amazing food from the 4 south Indian states. Sindoo...MoreGood ambience , Good food , variety of South Indian options in veg , non veg and sea food . Staff were courteous and Sindhu helped us in chooisingnoptions and serving . Strongly recommendGood ambience , Good food , variety of South Indian options in veg , non veg and sea food . Staff were courteous and Sindhu helped us in chooisingnoptions and serving . Strongly recommendThe food was really good thanks to chef murali.And my special thanks to Sindhu and Manmadha for greeting so good and suggesting the thali The service by them was really nice. We felt a homely nature. Will definitely visit with my familyThe food was really good thanks to chef murali.And my special thanks to Sindhu and Manmadha for greeting so good and suggesting the thali The service by them was really nice. We felt a homely nature. Will definitely visit with my familyIt was an extremely good experience.We had very limited idea about south indian cuisine.We were helped by Ms Sindhu who suggested the dishes.Every dish was tasty and the best one was the dessert Vuttalappam.We would love to come back again for another meal. :)It was an extremely good experience.We had very limited idea about south indian cuisine.We were helped by Ms Sindhu who suggested the dishes.Every dish was tasty and the best one was the dessert Vuttalappam.We would love to come back again for another meal. :)Great food, Sindhu guided us through the menu. The fish and the kodi pulav tastes really good. Wonderful hospitality and warm peopleGreat food, Sindhu guided us through the menu. The fish and the kodi pulav tastes really good. Wonderful hospitality and warm peopleFabulous food , services and Ambience. We were totally zapped by Sindhu, who advised us with food choices , which were finger licking delicious.Fabulous food , services and Ambience. We were totally zapped by Sindhu, who advised us with food choices , which were finger licking delicious.Very nice Lunch at Dakshin ! Real South taste coupled with the Care and hospitality of Sindhu , who can understand the taste , recommends good combination to an outsider and serves with love. I too appreciate the Manager Manmath’s contribution which made my lunch...MoreVery nice Lunch at Dakshin ! Real South taste coupled with the Care and hospitality of Sindhu , who can understand the taste , recommends good combination to an outsider and serves with love. I too appreciate the Manager Manmath’s contribution which made my lunch...MoreIncredible south Indian culinary experience. If you are a local or visiting from abroad and want a truly authentic experience I'd highly recommend Dakshin. Everything from the ambiance, decor, service and yes the food were exceptional. Must try are aapam and the dakshin vishesh (special)....MoreIncredible south Indian culinary experience. If you are a local or visiting from abroad and want a truly authentic experience I'd highly recommend Dakshin. Everything from the ambiance, decor, service and yes the food were exceptional. Must try are aapam and the dakshin vishesh (special)....More",0.58,Restaurant,2
38, Sri Sairam Parlour,1492.0,17.71196189,83.3183163,Vishakapatnam,https://www.tripadvisor.in/Restaurant_Review-g297588-d4764563-Reviews-Sri_Sairam_Parlour-Visakhapatnam_Visakhapatnam_District_Andhra_Pradesh.html,"A very good place for breakfast known as tiffins and typical Andhraite lunch called as meals. Also serve Other varieties as well.A very good place for breakfast known as tiffins and typical Andhraite lunch called as meals. Also serve Other varieties as well.Visited this restaurant during Feb. Ordered meals. The meal was cold and curries tasteless. The service is careless and not welcoming.Visited this restaurant during Feb. Ordered meals. The meal was cold and curries tasteless. The service is careless and not welcoming.Good food and services was excellent nice location I ordered masala dosa and one plate idly it was a really good taste thank youGood food and services was excellent nice location I ordered masala dosa and one plate idly it was a really good taste thank youWe had erlier good experience, but after lockdown the quality and test changed lot. Even the services gone down. Hope will changed soonWe had erlier good experience, but after lockdown the quality and test changed lot. Even the services gone down. Hope will changed soonRestaurant provides wide variety of tiffin, meals, biriyani. Quality is good enough and the service not bad, because always restaurant is full of crowd so it is easy to service. I suggest every one to visit this hotel and have great day!!Restaurant provides wide variety of tiffin, meals, biriyani. Quality is good enough and the service not bad, because always restaurant is full of crowd so it is easy to service. I suggest every one to visit this hotel and have great day!!6 adults and 3 kids went there for lunch. Though the restaurant wasnt crowded, we were made to wait for a long time, first to take the order and then to serve food. Food was good, not very great though. Dosas were good. Curd rice...More6 adults and 3 kids went there for lunch. Though the restaurant wasnt crowded, we were made to wait for a long time, first to take the order and then to serve food. Food was good, not very great though. Dosas were good. Curd rice...MoreThis restaurant have lots of varieties in south indian dishes, a must try thing... Especially loved the paper dosa...extremely delicious.... Taste is also very gud...This restaurant have lots of varieties in south indian dishes, a must try thing... Especially loved the paper dosa...extremely delicious.... Taste is also very gud...Hygienic food and quality also good. Try to visit on weekdays because of rush. Located in a good place.Hygienic food and quality also good. Try to visit on weekdays because of rush. Located in a good place.had food couple of times here during a recent visit. Very basic however clean. Had idlys during the evening which were cold. you can give it a try in case you are in a hurry to catch a bus in nearby bust standhad food couple of times here during a recent visit. Very basic however clean. Had idlys during the evening which were cold. you can give it a try in case you are in a hurry to catch a bus in nearby bust standThis is good veg hotel near railway station. Have nice seating arrangements on 1st floor whereas fast food is served on ground floor.This is good veg hotel near railway station. Have nice seating arrangements on 1st floor whereas fast food is served on ground floor.If u r looming for cost effective and some interesting options in south indian snacks, sairam is a good option. I had Ragi rava dosa and it was good. Reasonable rates and a functional eatery. Not for those who are looking at fine dining. But...MoreIf u r looming for cost effective and some interesting options in south indian snacks, sairam is a good option. I had Ragi rava dosa and it was good. Reasonable rates and a functional eatery. Not for those who are looking at fine dining. But...MoreHave been a regular visitor here since a decade. With different segments one can actually choose which one suits his /her pocket. Food is just about awesome in all the three segments. I generally catch a quick bite in the ground floor standing segment as...MoreHave been a regular visitor here since a decade. With different segments one can actually choose which one suits his /her pocket. Food is just about awesome in all the three segments. I generally catch a quick bite in the ground floor standing segment as...MoreService was terrible as we entered the restaurant at 9pm and the bearer said last order and only 3 to 4 items available. Lot of oil in the paneer and the taste was terrible. I would strictly advise a big no for this place.Service was terrible as we entered the restaurant at 9pm and the bearer said last order and only 3 to 4 items available. Lot of oil in the paneer and the taste was terrible. I would strictly advise a big no for this place.It's a very neat and clean restaurant. GREAT south Indian food at great price. Loved it. we had Dosa, wada, poori and everything tasted so well. Especially badam milk. It would have been great if elevated is provided. Difficult for senior citizens to reach to...MoreIt's a very neat and clean restaurant. GREAT south Indian food at great price. Loved it. we had Dosa, wada, poori and everything tasted so well. Especially badam milk. It would have been great if elevated is provided. Difficult for senior citizens to reach to...Morewe went in hurry to grab tifin/dinner it is anytime crowdy place... felt both takeaway and dine in crowdy. food is good. loved taste and a bit pricey like 30+ rs for 2 idli. but ok to quality and it's famewe went in hurry to grab tifin/dinner it is anytime crowdy place... felt both takeaway and dine in crowdy. food is good. loved taste and a bit pricey like 30+ rs for 2 idli. but ok to quality and it's fame",0.52,Restaurant,1
