Unnamed: 0,Name of the hotel,Weighted value,Latitude,Longitude,City,Link,Reviews,sentiment_score,Type,Cluster
0,Kebabs & Kurries,5545.0,17.71639232,79.45791558,Hyderabad,https://www.tripadvisor.in/Restaurant_Review-g297586-d3419910-Reviews-Kebabs_Kurries-Hyderabad_Hyderabad_District_Telangana.html,"Visited to best restaurant in the city with my kids tried best food after so many days.Valantine menu was regular it was little disappointed 😞 service was good.Visited to best restaurant in the city with my kids tried best food after so many days.Valantine menu was regular it was little disappointed 😞 service was good.Tried different tandoori items and Naan. Food was average in taste. Compare to the quantity, it was very costly. Staff were very polite and helpful.MoreTried different tandoori items and Naan. Food was average in taste. Compare to the quantity, it was very costly. Staff were very polite and helpful.MoreI have been long stays there in itc kakatiya I dined in kebab & kurries today the nihari was really good I enjoyed a lot and the amazing service by Sai bhaskar, Keya thank youMoreI have been long stays there in itc kakatiya I dined in kebab & kurries today the nihari was really good I enjoyed a lot and the amazing service by Sai bhaskar, Keya thank youMoreThe ambiance was great and food was awesome! Service was excellent. Delighted with a birthday cake too. Recommend for a leisurely dining. Hari.MoreThe ambiance was great and food was awesome! Service was excellent. Delighted with a birthday cake too. Recommend for a leisurely dining. Hari.MoreWe visited the place for our anniversary. Very tasty food. Loved the chicken kebabs and dal bukhara. Would love to thank Mr. Shekhar for his warm hospitality.MoreWe visited the place for our anniversary. Very tasty food. Loved the chicken kebabs and dal bukhara. Would love to thank Mr. Shekhar for his warm hospitality.MoreVisited kebabs and kurries.Serivce was good. Must try dish was mutton biryani.. best place to visit with family espcially in christmas timeMoreVisited kebabs and kurries.Serivce was good. Must try dish was mutton biryani.. best place to visit with family espcially in christmas timeMoreAmbience is soooooooo so good. Good hospitality. Food taste is awesome 👌 perfect place to enjoy lunch or dinner with your loved onesMoreAmbience is soooooooo so good. Good hospitality. Food taste is awesome 👌 perfect place to enjoy lunch or dinner with your loved onesMoreAbsolutely great food. The beetroot tikki was very unique and tasty, the dal Bukhara was fantastic and so was the chicken curry cooked in dum style. The warqi parata was something we had never had and was also incredibly tasty. And the person serving us...MoreAbsolutely great food. The beetroot tikki was very unique and tasty, the dal Bukhara was fantastic and so was the chicken curry cooked in dum style. The warqi parata was something we had never had and was also incredibly tasty. And the person serving us...MoreNice ambience and food, enjoyed deserts and kids loved eating starters and ice cream. Thank you. I will visit againMoreNice ambience and food, enjoyed deserts and kids loved eating starters and ice cream. Thank you. I will visit againMoreFood here is prepared, cooked and served with large doses of care and concern. Mindblowing! Thats why Kpop stars come here secretly…MoreFood here is prepared, cooked and served with large doses of care and concern. Mindblowing! Thats why Kpop stars come here secretly…MoreHello Team. . Came with no expectations to this place... But when food was at the table I we were blown... Food was out of the world and icing to the cake is when you have amazing staff on the board specially KEYA...she helped us...MoreHello Team. . Came with no expectations to this place... But when food was at the table I we were blown... Food was out of the world and icing to the cake is when you have amazing staff on the board specially KEYA...she helped us...MoreVery nice ambience. Food is really great and tasty. Professional staff behavior. We enjoyed a lot. Thank youMoreVery nice ambience. Food is really great and tasty. Professional staff behavior. We enjoyed a lot. Thank youMoreHad a lovely lunch at ITC Kakatiya Kababs and Kurries. Starters and kababs were exquisite. Staff behaviour and service was also very good.MoreHad a lovely lunch at ITC Kakatiya Kababs and Kurries. Starters and kababs were exquisite. Staff behaviour and service was also very good.MoreWe are visiting for the first time but it was an very good experience. great food and great service .MoreWe are visiting for the first time but it was an very good experience. great food and great service .MoreEach and every dish was well prepared and delicious. The service led by Sai and team was outstanding. Thank you GM, Mr Chibba , your leadership was reflected in every aspect . We were a group of 12 and enjoyed the exclusive area assigned. The...MoreEach and every dish was well prepared and delicious. The service led by Sai and team was outstanding. Thank you GM, Mr Chibba , your leadership was reflected in every aspect . We were a group of 12 and enjoyed the exclusive area assigned. The...More",0.56,Restaurant,1
1,Deccan Pavilion,5490.0,17.43244726,78.38668934,Hyderabad,https://www.tripadvisor.in/Restaurant_Review-g297586-d1738742-Reviews-Deccan_Pavilion-Hyderabad_Hyderabad_District_Telangana.html,"Had four of us dinner buffet at Deccan pavilion. Spread is ok. All items are good. It was a fabulous experience. I am appreciating mr.riaz for the service and the food was delicious like everytime. Thanks a lot to ITC team and riaz.MoreHad four of us dinner buffet at Deccan pavilion. Spread is ok. All items are good. It was a fabulous experience. I am appreciating mr.riaz for the service and the food was delicious like everytime. Thanks a lot to ITC team and riaz.MoreVisited city Hyderabad, I feel best hotel in the city Yummy every food. The dessert counter was too good Riaz the person who assisted us for the best service ,always available for anythingMoreVisited city Hyderabad, I feel best hotel in the city Yummy every food. The dessert counter was too good Riaz the person who assisted us for the best service ,always available for anythingMoreWe as a team had visited ITC Kakatiya for our lunch as a part of our year project get together. Prior to reaching hotel, we had a seamless experience and welcoming note from the staff in bookings and making necessary arrangements. As we entered, the...MoreWe as a team had visited ITC Kakatiya for our lunch as a part of our year project get together. Prior to reaching hotel, we had a seamless experience and welcoming note from the staff in bookings and making necessary arrangements. As we entered, the...MoreThis is my first experience in deccan pavilion. Mr riaz is briefly explain about the buffet and excellent service by mr. Ashit and the food is also nice I must visit again and take another experience of the food and service thank you Mr. Riaz.MoreThis is my first experience in deccan pavilion. Mr riaz is briefly explain about the buffet and excellent service by mr. Ashit and the food is also nice I must visit again and take another experience of the food and service thank you Mr. Riaz.MoreThe second solo trip of mine and I’m really blessed that I’ve choose to stay in this hotel. Especially the coffee shop from morning breakfast to anytime at night they are alwa Available with warm smile. Food a part of our living style but the...MoreThe second solo trip of mine and I’m really blessed that I’ve choose to stay in this hotel. Especially the coffee shop from morning breakfast to anytime at night they are alwa Available with warm smile. Food a part of our living style but the...MoreEnjoyed their multi cuisine food as the selection is Elaborate and staff are supportive and helpful. Worth visiting during weekends..MoreEnjoyed their multi cuisine food as the selection is Elaborate and staff are supportive and helpful. Worth visiting during weekends..MoreWe as a family had visited ITC kakatiya for our breakfast after the early morning Christmas service.As we entered ,the ambiance was great and then we settled for the breakfast.Food was very good and the services rendered was excellent.we were well taken care of from...MoreWe as a family had visited ITC kakatiya for our breakfast after the early morning Christmas service.As we entered ,the ambiance was great and then we settled for the breakfast.Food was very good and the services rendered was excellent.we were well taken care of from...MoreDeccan pavilion may be the most popular restaurant in around for great service and ambiance, amezing people, outstanding food. Thank u so much deccan pavilion team to make our reunion party more memorable. Im really so happy for urs gesture that u have given to...MoreDeccan pavilion may be the most popular restaurant in around for great service and ambiance, amezing people, outstanding food. Thank u so much deccan pavilion team to make our reunion party more memorable. Im really so happy for urs gesture that u have given to...MoreThe Christmas ambience was very beautiful 👍 also th services rendered was excellent. The food was very good. Would specially like to mention the services of Yadav Srinivas Keya karunakar Gayatri nd Vamsi was excellent 👌 they were polite nd catered to all that we...MoreThe Christmas ambience was very beautiful 👍 also th services rendered was excellent. The food was very good. Would specially like to mention the services of Yadav Srinivas Keya karunakar Gayatri nd Vamsi was excellent 👌 they were polite nd catered to all that we...MoreWe were extremely happy by the excellent hospitality by staff Yadav,Srinivas,Keya, karnataka,vamshi,gayatri. Appreciate the Delicious food& comfortable ambience too. Keep up the surge for excellence!!MoreWe were extremely happy by the excellent hospitality by staff Yadav,Srinivas,Keya, karnataka,vamshi,gayatri. Appreciate the Delicious food& comfortable ambience too. Keep up the surge for excellence!!MoreHad a wonderful time at this place with my friends on Christmas Day. The food was amazing and every dish was made so perfectly. The staff was just so amazing that i couldn't find any fault in them. To be more specific Mr. Yadav, Mr....MoreHad a wonderful time at this place with my friends on Christmas Day. The food was amazing and every dish was made so perfectly. The staff was just so amazing that i couldn't find any fault in them. To be more specific Mr. Yadav, Mr....MoreXmas lunch at ITC was a fabulous experience,Fully enjoyed. Thanking Yadav, Srinivas, Vanshi, Mani for the hospitalityMoreXmas lunch at ITC was a fabulous experience,Fully enjoyed. Thanking Yadav, Srinivas, Vanshi, Mani for the hospitalityMoreHad a amazing time at ITC at Christmas lunch, food was of very high standard compare to other hotels I visited before and they had live music to( may be because of Christmas ).MoreHad a amazing time at ITC at Christmas lunch, food was of very high standard compare to other hotels I visited before and they had live music to( may be because of Christmas ).MoreVery few hotel or restaurant knows how to serve solo dinner. I'm really glad and happy that i have found such place like deccan pavilion and the people over there ooh my god. They are just family members within few time they made me feel...MoreVery few hotel or restaurant knows how to serve solo dinner. I'm really glad and happy that i have found such place like deccan pavilion and the people over there ooh my god. They are just family members within few time they made me feel...MoreAmezing ambiance , excellent service will see u soon Pavilion . Spent a really good time after such a long time.MoreAmezing ambiance , excellent service will see u soon Pavilion . Spent a really good time after such a long time.More",0.64,Restaurant,2
2,Dakshin,4715.0,17.43820519,78.45565942,Hyderabad,https://www.tripadvisor.in/Restaurant_Review-g297586-d810661-Reviews-Dakshin-Hyderabad_Hyderabad_District_Telangana.html,"Nice ambience. Good food. Peaceful business talks over lunch. Loved the sweet paniyaram. Sabudhana uttapam.MoreNice ambience. Good food. Peaceful business talks over lunch. Loved the sweet paniyaram. Sabudhana uttapam.MoreThe food and ambience was good wonderful. Enjoyed every bit. Starter kodi gajala was good. Basundi sweet was yummy. Parota and kodi iguru was good too.MoreThe food and ambience was good wonderful. Enjoyed every bit. Starter kodi gajala was good. Basundi sweet was yummy. Parota and kodi iguru was good too.MoreIt was an excellent experience overall. The food was very impressive in terms of taste and variety. Got to try a lot of south Indian dishes. And the food service was very good thanks to Mr AnthonyMoreIt was an excellent experience overall. The food was very impressive in terms of taste and variety. Got to try a lot of south Indian dishes. And the food service was very good thanks to Mr AnthonyMoreIt was our first time at Dakshin restaurant. We had an amazing experience. Food was good. The service by Mr. Anthony was awesome.MoreIt was our first time at Dakshin restaurant. We had an amazing experience. Food was good. The service by Mr. Anthony was awesome.MoreWe had Mutton Stew and Appam and it was Fantabulous. The taste was soo soothing and amazing. Our stomach was full but the taste buds kept asking for more. Thank you Dakshin staff and Chef Muthu for such an amazing preparation of dishes. We love...MoreWe had Mutton Stew and Appam and it was Fantabulous. The taste was soo soothing and amazing. Our stomach was full but the taste buds kept asking for more. Thank you Dakshin staff and Chef Muthu for such an amazing preparation of dishes. We love...MoreWe had the thali. The service was quick and the staff were very kind and accomodating. The food was really scrumptious and we found ourselves going in for seconds. Overall had an amazing experience.MoreWe had the thali. The service was quick and the staff were very kind and accomodating. The food was really scrumptious and we found ourselves going in for seconds. Overall had an amazing experience.MoreWe had a fantastic experience with the restaurant in ITC. The service was excellent and the food had so much of variety. Definitely recommended this restaurant for a visit while in hyderabad! 😊MoreWe had a fantastic experience with the restaurant in ITC. The service was excellent and the food had so much of variety. Definitely recommended this restaurant for a visit while in hyderabad! 😊MoreSome real whistle podu kinda food you get here .. thali is must have which is like little burst of flavours from the south.. for sure gonna come back again and try the rest of the menu.MoreSome real whistle podu kinda food you get here .. thali is must have which is like little burst of flavours from the south.. for sure gonna come back again and try the rest of the menu.MoreThe starters are good but not super great. One can find them in many popular restaurants in Hyderabad with better taste. The main course rasam. Sambhar and potato fry are not good. Not many choices and food is not well balanced. Curd tastes okay. Not...MoreThe starters are good but not super great. One can find them in many popular restaurants in Hyderabad with better taste. The main course rasam. Sambhar and potato fry are not good. Not many choices and food is not well balanced. Curd tastes okay. Not...MoreWe love this restaurant. Amazing food as usual. Anthony looked after us so well and was extremely helpful, efficient and fast. Lovely evening.MoreWe love this restaurant. Amazing food as usual. Anthony looked after us so well and was extremely helpful, efficient and fast. Lovely evening.MoreI’ve been to Dakshin many times whenever I visit Hyderabad. This time, the food was just horrible. We ordered chapala pulusu (fish in a tomato-based gravy), shrimp, mutton, and chicken. All dishes were just not well balanced. The fish was just spicy without any other...MoreI’ve been to Dakshin many times whenever I visit Hyderabad. This time, the food was just horrible. We ordered chapala pulusu (fish in a tomato-based gravy), shrimp, mutton, and chicken. All dishes were just not well balanced. The fish was just spicy without any other...MoreWe started out with some Appam’s paired with pachakari stew, which was very well made. It is is a must try. The masala fried prawns were very flavourful and delicious. Mr Anthony who was taking care of us had a special Mutton dish prepared for...MoreWe started out with some Appam’s paired with pachakari stew, which was very well made. It is is a must try. The masala fried prawns were very flavourful and delicious. Mr Anthony who was taking care of us had a special Mutton dish prepared for...MoreI liked the food it really delicious😋 nice place for foodies to taste the Multi cuisine amazing moment at dakshin and staff is very friendly 😍MoreI liked the food it really delicious😋 nice place for foodies to taste the Multi cuisine amazing moment at dakshin and staff is very friendly 😍MoreITC dakshin has different kind of delicious southern food i love the taste of food it's really good nice place to visit😋MoreITC dakshin has different kind of delicious southern food i love the taste of food it's really good nice place to visit😋MoreI liked the Food, food was very delicious 🤤😋it has completely South Indian taste and staff service is good and friendlyMoreI liked the Food, food was very delicious 🤤😋it has completely South Indian taste and staff service is good and friendlyMore",0.66,Restaurant,2
3, Bawarchi,4158.0,17.43908544,78.4007664,Hyderabad,https://www.tripadvisor.in/Restaurant_Review-g297586-d1673026-Reviews-Bawarchi-Hyderabad_Hyderabad_District_Telangana.html,"We enjoyed the chicken & mutton biryani and chicken 65. Both dishes were authentic hyderabdi taste. Quantity was good too , with great service. Cant wait to visit again..againWe enjoyed the chicken & mutton biryani and chicken 65. Both dishes were authentic hyderabdi taste. Quantity was good too , with great service. Cant wait to visit again..againThe staff was very courteous, and polite and showed professional behavior. They were all very welcoming and made me feel comfortable the moment I walked in. But being one of the most famous restaurants in Hyderabad, their selection of city cuisine was only limited to...MoreThe staff was very courteous, and polite and showed professional behavior. They were all very welcoming and made me feel comfortable the moment I walked in. But being one of the most famous restaurants in Hyderabad, their selection of city cuisine was only limited to...MoreTasty food, recommended restaurant for biryani. Affordable price, good interior design, nice atmosphereTasty food, recommended restaurant for biryani. Affordable price, good interior design, nice atmosphereI have heard good reviews and I carried Veg Biryani but whole experience ended very bad. Not recommended for anyoneI have heard good reviews and I carried Veg Biryani but whole experience ended very bad. Not recommended for anyoneIt was a big disappointment on the New Year day going to Bawarchi for Lunch with my family. I was a big time fan of Bawarchi Biryani until today, however I will not be any more. We probably were the first customers to visit around...MoreIt was a big disappointment on the New Year day going to Bawarchi for Lunch with my family. I was a big time fan of Bawarchi Biryani until today, however I will not be any more. We probably were the first customers to visit around...Morepls dont eat food at Bawarchi hyderabad.the staff are completely arrogant and food is too much spicy with excess salt added into it.if u order veg fried rice then u will get a mix of plain white rice with boiled vegetables.most unhygenic restaurant #WorstBiryani #FakeReviews...Morepls dont eat food at Bawarchi hyderabad.the staff are completely arrogant and food is too much spicy with excess salt added into it.if u order veg fried rice then u will get a mix of plain white rice with boiled vegetables.most unhygenic restaurant #WorstBiryani #FakeReviews...MoreI visited Bawarchi restaurant to have Biryani and it was really good in taste. They have veg as well as non veg biryani to serve.I visited Bawarchi restaurant to have Biryani and it was really good in taste. They have veg as well as non veg biryani to serve.Not a clean restaurant but the biryani they serve is delicious and the quantity was also good compare to the other restaurants . must try restaurantNot a clean restaurant but the biryani they serve is delicious and the quantity was also good compare to the other restaurants . must try restaurantThe totall environment is bad and it's a little bit higher and quantity also average and quality is good, worst spicy with no flavor ,and totall staff and maintenance also worst but prices are high, better not to goThe totall environment is bad and it's a little bit higher and quantity also average and quality is good, worst spicy with no flavor ,and totall staff and maintenance also worst but prices are high, better not to goOne of my colleagues working in Hyderabad had suggested this place. I wanted to eat authentic Hyderabadi Biryani and the taste here of Biryani was awesome. The taste was unique.One of my colleagues working in Hyderabad had suggested this place. I wanted to eat authentic Hyderabadi Biryani and the taste here of Biryani was awesome. The taste was unique.Famous for traditional hyderabadi biryani. It's been long time since they make authentic hyderabadi biryani. Still the same taste even after years of service. I would love to visit again to bawarchi with friends for a tasty biryani treat.Famous for traditional hyderabadi biryani. It's been long time since they make authentic hyderabadi biryani. Still the same taste even after years of service. I would love to visit again to bawarchi with friends for a tasty biryani treat.Bawarchi wich splendid in taste prepared in Dum Ka style using fresh pieces of mutton marinate in secret hyderbad spices mixes with basmathi rice served with salan and raitha articulation of the hyderabadi ethos and personalityBawarchi wich splendid in taste prepared in Dum Ka style using fresh pieces of mutton marinate in secret hyderbad spices mixes with basmathi rice served with salan and raitha articulation of the hyderabadi ethos and personalityThe aroma itself fills the stomach, I suggest going into AC section, as the non - AC sections is bit noisy & smoky. Overall the biryani is upto it's known standards.The aroma itself fills the stomach, I suggest going into AC section, as the non - AC sections is bit noisy & smoky. Overall the biryani is upto it's known standards.There are two Bawarchi buildings facing opposite to each other. The one opp. to Kebabs is the AC restaurant.Vallet parking available. The Ambience of the restaurant can be rated as 2/5 compared to say the famous ""Chutneys"". We ordered Chicken and Mutton biriyani.The quantity was...MoreThere are two Bawarchi buildings facing opposite to each other. The one opp. to Kebabs is the AC restaurant.Vallet parking available. The Ambience of the restaurant can be rated as 2/5 compared to say the famous ""Chutneys"". We ordered Chicken and Mutton biriyani.The quantity was...MoreAfter seeing positive reviews we visited to taste biryani at bawarchi restaurant at Hyderabad. But after eating mutton and chicken both biryani i feel that it was Worst biryani tasted ever.After seeing positive reviews we visited to taste biryani at bawarchi restaurant at Hyderabad. But after eating mutton and chicken both biryani i feel that it was Worst biryani tasted ever.",0.34,Restaurant,2
