23,Mist The Poolside Kitchen,855.0,17.42086275,78.41141991,Hyderabad,https://www.tripadvisor.in/Restaurant_Review-g297586-d13374117-Reviews-Mist_The_Poolside_Kitchen-Hyderabad_Hyderabad_District_Telangana.html,"First time I visited and i loved Place, hygienic food and good staff with well behaved Thanks, Syed.First time I visited and i loved Place, hygienic food and good staff with well behaved Thanks, Syed.Place is very good. If you are looking for a romantic dinner,you should definitely visit this place. Hospitality is also very good. Mr pavan kumar attended us and he is very polite and took care of us very well. Service is very good. Food is...MorePlace is very good. If you are looking for a romantic dinner,you should definitely visit this place. Hospitality is also very good. Mr pavan kumar attended us and he is very polite and took care of us very well. Service is very good. Food is...MoreThe perfect place for a quiet high quality dinner just a few minutes away from the city. Special mention to our host from the restaurant- Kushal! Professional, polite and super pleasant!The perfect place for a quiet high quality dinner just a few minutes away from the city. Special mention to our host from the restaurant- Kushal! Professional, polite and super pleasant!The ambience, the food and service everything is very good at this restaurant. The attendant Pavan was very hospitable and was very prompt in taking care of our needs. Had a very good time with family.The ambience, the food and service everything is very good at this restaurant. The attendant Pavan was very hospitable and was very prompt in taking care of our needs. Had a very good time with family.We had a great time at the poolside restaurant. The food was excellent in terms of presentation and taste. Also a special mention to Bikas and Pavan who served our food and made our lunch special with a cake for our anniversaryWe had a great time at the poolside restaurant. The food was excellent in terms of presentation and taste. Also a special mention to Bikas and Pavan who served our food and made our lunch special with a cake for our anniversaryGreat property... Amazing ambience. The staff is pleasant and absolutely professional with their service. Must visit with family and friends.Great property... Amazing ambience. The staff is pleasant and absolutely professional with their service. Must visit with family and friends.Most amazing freshly prepared food.Loved the ambience. Service was exemplary ...and ...... with a smileMost amazing freshly prepared food.Loved the ambience. Service was exemplary ...and ...... with a smileWe came here for our Anniversary. The food is amazing here. The staff specially Pawan Kumar was really helpful and took care of us until the time we finished our food. Overall super satisfied with Golkonda- they never disappoint us !!We came here for our Anniversary. The food is amazing here. The staff specially Pawan Kumar was really helpful and took care of us until the time we finished our food. Overall super satisfied with Golkonda- they never disappoint us !!The most excellent service i had ever recived The staf was so kind And we also tried a different food The food was yummy 😋 The place is also so beautifull The staff members VIKAS and SUJITH helped us a lot thanks to them Thakyou...MoreThe most excellent service i had ever recived The staf was so kind And we also tried a different food The food was yummy 😋 The place is also so beautifull The staff members VIKAS and SUJITH helped us a lot thanks to them Thakyou...MoreIt was a great experience overall. Mr Pavan kumar was polite during our visit. Food can be served a bit quickly.It was a great experience overall. Mr Pavan kumar was polite during our visit. Food can be served a bit quickly.The Mist Poolside Kitchen has been a pleasure to visit to. Besides their excellent food, Srujith made the entire experience even better by his hospitality. Do visit.The Mist Poolside Kitchen has been a pleasure to visit to. Besides their excellent food, Srujith made the entire experience even better by his hospitality. Do visit.Had a good time at this restaurant with my wife. We went for dinner. The food was great. I liked it.Had a good time at this restaurant with my wife. We went for dinner. The food was great. I liked it.Best place to have a romantic dinner. The food taste is so good and the quantity is descent too. The service is warm enough. we were hosted by Mr Pawan Kumar and he served us very wellBest place to have a romantic dinner. The food taste is so good and the quantity is descent too. The service is warm enough. we were hosted by Mr Pawan Kumar and he served us very wellVIisited for our anniversary celebration on Nov 22, 2022. It was very pleasant, staff were very friendly(Mr.Anuj) and co-operative😊 Overall memorable day..VIisited for our anniversary celebration on Nov 22, 2022. It was very pleasant, staff were very friendly(Mr.Anuj) and co-operative😊 Overall memorable day..Ambience was beautiful and food was also decent. Anuj served us good. The mist Golconda resorts a must visit places in Hyderabad.Ambience was beautiful and food was also decent. Anuj served us good. The mist Golconda resorts a must visit places in Hyderabad.",0.6,Restaurant,2
24, Saffron Soul,850.0,17.42319613,78.34878449,Hyderabad,https://www.tripadvisor.in/Restaurant_Review-g297586-d7959822-Reviews-Saffron_Soul-Hyderabad_Hyderabad_District_Telangana.html,"We had yesterday dinner it was fantastic we came at the last of dinner and it is going to be closed but the person who is attended us his very polite and good behaviour I think his name vamshi Thank you for your help and...MoreWe had yesterday dinner it was fantastic we came at the last of dinner and it is going to be closed but the person who is attended us his very polite and good behaviour I think his name vamshi Thank you for your help and...MoreWe had family dinner yesterday food is good and restaurant is almost full but i would like to Special thanks to Mr. VAMSHI who is actually very helpfull in the busy restaurant.We had very good dinner at restaurant thak you so much we visit again...MoreWe had family dinner yesterday food is good and restaurant is almost full but i would like to Special thanks to Mr. VAMSHI who is actually very helpfull in the busy restaurant.We had very good dinner at restaurant thak you so much we visit again...MoreWe had good business party at restaurant yesterday night we are all enjoyed lot with drinks and food. And staff is very helpful to each and everyone we will visit again definitely Special thanks to Service team👍We had good business party at restaurant yesterday night we are all enjoyed lot with drinks and food. And staff is very helpful to each and everyone we will visit again definitely Special thanks to Service team👍A group of 12 for a birthday celebration on 6th August 2022. A wonderful time was had by all. Starters served, at the table, fresh from the live counter. Service was superb. A special mention for Naresh, the F&B manager, who tended to every request...MoreA group of 12 for a birthday celebration on 6th August 2022. A wonderful time was had by all. Starters served, at the table, fresh from the live counter. Service was superb. A special mention for Naresh, the F&B manager, who tended to every request...MoreWent here for a lunch buffet. While the starters were nice, there wasn't anything special about the main course. Also saw some cockroaches crawling around near the buffet. The ambience was nice, but it also felt like one had to walk a lot to refill...MoreWent here for a lunch buffet. While the starters were nice, there wasn't anything special about the main course. Also saw some cockroaches crawling around near the buffet. The ambience was nice, but it also felt like one had to walk a lot to refill...MoreWe were celebrating our 25th marriage Anniversary in marigold hotel. Saffron soul Restaurant service team specially Mr. ANKIT and sai are giving us superb and best memorable service. Food is superb and our all guests were very happy. Thanks to all the Restaurant staff.We were celebrating our 25th marriage Anniversary in marigold hotel. Saffron soul Restaurant service team specially Mr. ANKIT and sai are giving us superb and best memorable service. Food is superb and our all guests were very happy. Thanks to all the Restaurant staff.Lovely food, great staff who feed you so kindly. I loved the service at the Saffron Soul restaurant.Lovely food, great staff who feed you so kindly. I loved the service at the Saffron Soul restaurant.Good hospitality with great food. Lavish spread food. A very nice in house restaurant . Very good buffet breakfast and a vast dinner spread. good service.Good hospitality with great food. Lavish spread food. A very nice in house restaurant . Very good buffet breakfast and a vast dinner spread. good service.Have heard a lot about the biryani, haleem of famous green park hotel from the day I have moved into the city, yesterday had a meeting nearby and decided to try out the food there. Post covid they are serving the food at saffron restaurant...MoreHave heard a lot about the biryani, haleem of famous green park hotel from the day I have moved into the city, yesterday had a meeting nearby and decided to try out the food there. Post covid they are serving the food at saffron restaurant...MoreWent with Family for breakfast. Enjoyed the wide spread Vegetarian delicacies. Taste dominated the falvours. Service is lethargicWent with Family for breakfast. Enjoyed the wide spread Vegetarian delicacies. Taste dominated the falvours. Service is lethargicA very delicious margarita pizza Get it customised by Rinku - Highly recommend his service Its a thin crust pizza and tastes somewhat like a wooden burnt pizzaA very delicious margarita pizza Get it customised by Rinku - Highly recommend his service Its a thin crust pizza and tastes somewhat like a wooden burnt pizzaUmesh from staff has been very friendly in attending and taking care of us. The food was tasty and variety was good.Umesh from staff has been very friendly in attending and taking care of us. The food was tasty and variety was good.It's is very good experience coming here with friends ,The service is absolutely good ,we got nice service from umeshIt's is very good experience coming here with friends ,The service is absolutely good ,we got nice service from umeshFood was really good. Service was excellent. Good Ambience. Nice place to visit with your friends. The service of Ymesh was really impressive.Food was really good. Service was excellent. Good Ambience. Nice place to visit with your friends. The service of Ymesh was really impressive.Good service and great atmosphere.... good service by Rinku pleasant music and good time spent all overGood service and great atmosphere.... good service by Rinku pleasant music and good time spent all over",0.78,Restaurant,2
25, Indus - Coffee Shop & Multi-Cuisine Restaurant,735.0,17.40608922,78.45537397,Hyderabad,https://www.tripadvisor.in/Restaurant_Review-g297586-d3610983-Reviews-Indus_Coffee_Shop_Multi_Cuisine_Restaurant-Hyderabad_Hyderabad_District_Telangana.html,"Nice stay at Ella hotel, Hyderabad. Breakfast was amazing. All restaurant staff specially Manisha & Sagarika were fabulous towards hospitality.Nice stay at Ella hotel, Hyderabad. Breakfast was amazing. All restaurant staff specially Manisha & Sagarika were fabulous towards hospitality.Great experience, excellent decoration and service. Well curated 4 course meal. Special mention to Manisha.Great experience, excellent decoration and service. Well curated 4 course meal. Special mention to Manisha.Puja she is a good person with great hospitality skills and a good orator with good communication skills .... Nice attitude.... Sweet person... Good food.. Lovely combo nice menu... Tasty food good to goPuja she is a good person with great hospitality skills and a good orator with good communication skills .... Nice attitude.... Sweet person... Good food.. Lovely combo nice menu... Tasty food good to goThis restaurant is really good, Food is amazing!! The Waiter were very good, Waiter Sahabur is given very good serviceThis restaurant is really good, Food is amazing!! The Waiter were very good, Waiter Sahabur is given very good serviceFood and service was great. Must visit the place for your special occasions. Mr. Saha bur took care of us nicely. Assured privacy was given. Very impressiveFood and service was great. Must visit the place for your special occasions. Mr. Saha bur took care of us nicely. Assured privacy was given. Very impressiveVery good hotel. Good and fast service. Great rooms. A small improvement of cleanliness on drapes and mattresses is required. My personal experience: Breakfast was very good. Sahabur was very proactive and provided us withe excellent service at the buffet. He especially took care of...MoreVery good hotel. Good and fast service. Great rooms. A small improvement of cleanliness on drapes and mattresses is required. My personal experience: Breakfast was very good. Sahabur was very proactive and provided us withe excellent service at the buffet. He especially took care of...MoreHad visited Indus Cafe for lunch buffet and had a disappointing experience. The spread isn’t that good. Many of the items were either old or finished. The refills took forever to come and service was also quite slow. The place is quite overhyped and is...MoreHad visited Indus Cafe for lunch buffet and had a disappointing experience. The spread isn’t that good. Many of the items were either old or finished. The refills took forever to come and service was also quite slow. The place is quite overhyped and is...MoreHad gone to Indus Ella Hotels with family for lunch and had an awful experience. Starting from the food to service and ambience, everything was below average and awful. The food was cold and tasted just normal. The naan & breads took forever to come....MoreHad gone to Indus Ella Hotels with family for lunch and had an awful experience. Starting from the food to service and ambience, everything was below average and awful. The food was cold and tasted just normal. The naan & breads took forever to come....MoreThe restaurant was wonderful and served variety of delicacies. The Indus restaurant staffs were cordial and ever helpful and one of the Stewart by the name Sahabur was very polite and cheerful. We had a good time and shall recommend my friend for the stay...MoreThe restaurant was wonderful and served variety of delicacies. The Indus restaurant staffs were cordial and ever helpful and one of the Stewart by the name Sahabur was very polite and cheerful. We had a good time and shall recommend my friend for the stay...MoreI highly recommend Ella hotel. Very nice and courteous experience.Special thanks to Surajit and Sahabur as they are very nice and polite.I highly recommend Ella hotel. Very nice and courteous experience.Special thanks to Surajit and Sahabur as they are very nice and polite.Sahabur was the only one I liked at this hotel or about hotel. He helped me during my dining and while I was working in the evening. He was Prompt and was available asking for any help. Apart from this I would not recommend this...MoreSahabur was the only one I liked at this hotel or about hotel. He helped me during my dining and while I was working in the evening. He was Prompt and was available asking for any help. Apart from this I would not recommend this...MoreExcellent guidance and service by the staff. They have very prompt and curteous service. The coordination between the duty manager and sales team is excellent. We are in much appreciation for the services rendered by Sahabur and Akshansh. Loved the food and ambience :) Overall,...MoreExcellent guidance and service by the staff. They have very prompt and curteous service. The coordination between the duty manager and sales team is excellent. We are in much appreciation for the services rendered by Sahabur and Akshansh. Loved the food and ambience :) Overall,...MoreGood Place to visit and Food is very tasty and nice and excellent staff to serve especially Surajit is very polite and he serve the Food quickly and always take care for the guestsGood Place to visit and Food is very tasty and nice and excellent staff to serve especially Surajit is very polite and he serve the Food quickly and always take care for the guestsCourteous staff, well packed buffet. When I stopped by, I didn't feel like the entire buffet course but was interested in one or two dishes. Surojit and Kuldeep went out of their way to ensure that I was provided with the dishes of my choice...MoreCourteous staff, well packed buffet. When I stopped by, I didn't feel like the entire buffet course but was interested in one or two dishes. Surojit and Kuldeep went out of their way to ensure that I was provided with the dishes of my choice...MoreGreat service really appreciated. Team leader Mr. Kuldeep good leading to his team . They are giving service beyond expectations. Really enjoy service of suronjit he is very active person .Great service really appreciated. Team leader Mr. Kuldeep good leading to his team . They are giving service beyond expectations. Really enjoy service of suronjit he is very active person .",0.5,Restaurant,2
26, Tre-Forni,567.0,17.44289724,78.38300606,Hyderabad,https://www.tripadvisor.in/Restaurant_Review-g297586-d3165106-Reviews-Tre_Forni-Hyderabad_Hyderabad_District_Telangana.html,"Excellent food . Five stars to our server Ms. Shilpa who made our visit so heartwarming. The tiramisu at the end was just melting in the mouthExcellent food . Five stars to our server Ms. Shilpa who made our visit so heartwarming. The tiramisu at the end was just melting in the mouthThe food in this restaurant is amazing. It is one of the best Italian food in India. Shilpa & lacuna were very sweet and served us the best food! Will definitely recommend to friends and family! Desserts especially were simply superb.The food in this restaurant is amazing. It is one of the best Italian food in India. Shilpa & lacuna were very sweet and served us the best food! Will definitely recommend to friends and family! Desserts especially were simply superb.Food and service has been great. Pasta and Trio Di Cioccolato were excellent. Must visit when in townFood and service has been great. Pasta and Trio Di Cioccolato were excellent. Must visit when in townVery good brunch. Love the service and selections. Shilpa was very helpful and sweet. The deserts were truly done by a master.Very good brunch. Love the service and selections. Shilpa was very helpful and sweet. The deserts were truly done by a master.The best Italian food in Hyderabad. Fine dining at its best. The poached pear salad , mushroom ravioli and spaghetti pesto is to die for. The Breads are so flavourful and delicious. Special thanks to Shilpa who was so helpful and made our evening and...MoreThe best Italian food in Hyderabad. Fine dining at its best. The poached pear salad , mushroom ravioli and spaghetti pesto is to die for. The Breads are so flavourful and delicious. Special thanks to Shilpa who was so helpful and made our evening and...MoreAmazing and authentic Italian food in Hyderabad. Risotto and Tiramisu are some of the must haves here.MoreAmazing and authentic Italian food in Hyderabad. Risotto and Tiramisu are some of the must haves here.MoreAbsolutely loved the food and the service. Shilpa was especially hospitable. All in all, made for a great meal!Absolutely loved the food and the service. Shilpa was especially hospitable. All in all, made for a great meal!Dinner with family ....great ambience....super food ......relaxed atmosphere......and above all awesome hospitality by Robin satay...& shitanshu......Dinner with family ....great ambience....super food ......relaxed atmosphere......and above all awesome hospitality by Robin satay...& shitanshu......It's an excellent hotel. What an ambience of all the restaurant . Must try following restaurants tri - forni what an excellent food must say . Simply outstanding. We tried salad prawn and barley excellent Pizza pepperoni superb Pasta was simply outstanding Tiramisu was icing...MoreIt's an excellent hotel. What an ambience of all the restaurant . Must try following restaurants tri - forni what an excellent food must say . Simply outstanding. We tried salad prawn and barley excellent Pizza pepperoni superb Pasta was simply outstanding Tiramisu was icing...MoreGerald was exceptional with his service. Made sure we got exactly what we wanted. Thank you Gerald! Food was amazing!MoreGerald was exceptional with his service. Made sure we got exactly what we wanted. Thank you Gerald! Food was amazing!MoreDinner was great. I loved the pasta and their vanilla panacotta is my favourite. The restaurant was full and we came without a reservation and Shilpa helped us get a nice table. I loved the service here. Overall it was a great experience.MoreDinner was great. I loved the pasta and their vanilla panacotta is my favourite. The restaurant was full and we came without a reservation and Shilpa helped us get a nice table. I loved the service here. Overall it was a great experience.MoreHad a very good experience at the restaurant. Food was good and the hospitality was even better…kudos to the team, especially Shilpa.Had a very good experience at the restaurant. Food was good and the hospitality was even better…kudos to the team, especially Shilpa.Mr. Gerald and your team and Chef Daniel was really attentive with me and my order. They packed the food perfectly. The food was delicious.MoreMr. Gerald and your team and Chef Daniel was really attentive with me and my order. They packed the food perfectly. The food was delicious.MoreWe really liked the food and enjoyed the atmosphere. Gerald’s service in particular was great! Would recommend Tre Forni to anyone looking for an enjoyable Italian meal!We really liked the food and enjoyed the atmosphere. Gerald’s service in particular was great! Would recommend Tre Forni to anyone looking for an enjoyable Italian meal!Its my second visit to this restaurant and i loved it. The staff is very humble and polite especially Shilpa.Its my second visit to this restaurant and i loved it. The staff is very humble and polite especially Shilpa.",0.66,Restaurant,2
